URL,Title,Author,Type,Price,Summary,Publication Year,Language,ISBN,Category,Copyright,Contributors,Pages,Binding,Interior Color,Dimensions,Format,Keywords
https://www.lulu.com//shop/umar-iqbal/the-greatest-teacher/ebook/product-1vgq854r.html?q=Harvard+University,The Greatest Teacher,Umar Iqbal,Ebook,2.10,"The Greatest Teacher in the World is the culmination of years of research on self-help and personal development. To make these ideas more digestible and immediately applicable, these ideas have been presented in story form. Come join the 63-year-old Professor Izmir on a journey of life change and personal development!

About The Author

The author is currently a graduate student pursuing his Master of Business Administration (MBA) degree from The Wharton School at the University of Pennsylvania and his Master of Public Administration (MPA) degree from the John F. Kennedy School of Government at Harvard University.",2020,English,9781678175993,Personal Growth,All Rights Reserved - Standard Copyright License,By (author): Umar Iqbal,,,,,EPUB,"['Personal development', 'self help', 'motivation', 'success', 'inspiration', 'quotes']"
https://www.lulu.com//shop/robert-wood-darby/betrayal-and-conviction-memoir-of-a-generation/paperback/product-1qkzy29z.html?q=Harvard+University,"Betrayal and Conviction, Memoir of a Generation",Robert Wood Darby,Paperback,17.70,"Author Robert Wood Darby was born and raised in Georgia. This memoir is about the anti-racism advocate growing up in the fifties and sixties and coming of age in the segregated South during the Civil Rights Movement. Darby became an antiwar activist during the Vietnam War. He studied at Emory University, then at Tufts and Harvard in the late sixties - a time of upheaval for the entire country. He also chronicles his affliction with mental illness and manic depression, which has gone into remission.",2019,English,9780359757350,Biographies & Memoirs,All Rights Reserved - Standard Copyright License,By (author): Robert Wood Darby,308,Paperback,Black & White,US Trade (6 x 9 in / 152 x 229 mm),,"['Anti-racism', 'Civil Rights Movement', 'Antiwar Activist', 'Vietnam War', 'Mental Illness', 'Manic Depression']"
https://www.lulu.com//shop/tomeara-and-joan-gosier/lets-talk-about-brains/paperback/product-1rmp8djq.html?q=Harvard+University,Let's Talk About Brains,Tomeara and Joan Gosier,Paperback,10.00,"Often children wonder, ""How do I master self-control in my classroom?""  My elementary school uses a tool that rewards behavior that is ""on green"".  This means that you behaved well and completed your tasks.  My mommy and I developed this little book to help other children ""get on green"" each day!

********************DECEMBER 6, 2013 UPDATE*******


PLEASE HELP ME I REALLY WANT TO GO TO HARVARD THIS SUMMER!

At age 11, I have been nominated by my middle school to attend a LEADERSHIP SUMMER CAMP at HARVARD UNIVERSITY.  All purchases of this book help raise the funds to make it a REALITY!  It seems that this would be a good opportunity and I don't want to miss it.  It is a chance of a lifetime for me to learn some things that can make the world better for everyone!

Thank you so much for your support.",2009,English,N/A,Children's,All Rights Reserved - Standard Copyright License,By (author): Tomeara and Joan Gosier,10,Saddle Stitch,Color,Square (8.5 x 8.5 in / 216 x 216 mm),,"['behavior', 'brain', 'classroom', 'discipline', 'Tomeara Gosier', 'elementary', 'school']"
https://www.lulu.com//shop/jon-snow/psy-530-week-4-assignment-latest-gcu/paperback/product-12qnd755.html?q=Harvard+University,PSY 530 WEEK 4 ASSIGNMENT LATEST-GCU,Jon Snow,Paperback,8.06,"PSY 530 WEEK 4 ASSIGNMENT LATEST-GCU
Visit Below Link, To Download This Course:
https://www.tutorialsservice.net/product/psy-530-week-4-assignment-latest-gcu/

Or 
Email us on
[email protected]
PSY 530 Week 4 Assignment Latest-GCU
PSY530
PSY 530 Week 4 Assignment Latest-GCU
Details:
Take one (gender, age, race, sexuality, disability, or weight) of the Implicit Association Tests (IAT) at the Harvard University website. In 750-1,000 words, address the following:",2018,English,N/A,Education & Language,All Rights Reserved - Standard Copyright License,By (author): Jon Snow,2,Saddle Stitch,Black & White,US Letter (8.5 x 11 in / 216 x 279 mm),,"['INTERNATIONAL STUDY', 'COMPUTER SCiENCE', 'ENGINEERING & TECHNOLOGY', 'Accounting', 'Business']"
https://www.lulu.com//shop/richard-estes/book-of-hours-use-of-paris-about-1420-25/paperback/product-1jn9wzpd.html?q=Harvard+University,BOOK OF HOURS (USE OF PARIS) ABOUT 1420-25,RICHARD ESTES,Paperback,35.00,"This Book is from the Richardson #42 at Houghton Library, Harvard University at Cambridge, Mass. It has 404 pages but you will see the best 51 pages from the Book of Hours. If I did it all it would cost you more $100 but with the special pages it will cost you less the $50. If you have a comment or question, please use my e-mail: [email protected]",2012,English,9781105593123,History,All Rights Reserved - Standard Copyright License,By (author): RICHARD ESTES,59,Paperback,Color,US Letter (8.5 x 11 in / 216 x 279 mm),,['Book of Hours']
https://www.lulu.com//shop/renzhi-notes/mobile-book-boston/ebook/product-17qdv8ym.html?q=Harvard+University,Mobile Book Boston,Renzhi Notes,Ebook,1.00,"The Mobile Book is your travel guide. You can read by iPad or smartphone(some need install epub file reader). Travel to Boston.Visit to Harvard University, Museum of Fine Arts,Isabella Stewart Gardner Museum,The First Church of Christ, Scientist,Cathedral of the Holy Cross,Trinity Church,Freedom Trail,Boston Common,Old State House,Boston Massacre,Faneuil Hall,USS Constitution,Bunker Hill Monument,Museum of Science ,Tea Party Ships & Museum,Boston Harbor.",2016,English,9781329954564,Travel & Adventure,All Rights Reserved - Standard Copyright License,By (author): Renzhi Notes,,,,,EPUB,"['Mobile Book', 'travel guide', 'Boston', 'Harvard University', 'Museum', 'Fine Arts', 'Gardner Museum', 'Church of Christ', 'Scientist', 'Cathedral', 'Trinity Church', 'Freedom Trail', 'Boston Common', 'State House', 'Boston Massacre', 'Faneuil Hall', 'USS Constitution', 'Bunker Hill', 'Monument', 'Museum o']"
https://www.lulu.com//shop/glen-santayana/prischool-a-prison-school-hybrid/paperback/product-1qnd2qkp.html?q=Harvard+University,PriSchool: A Prison + School Hybrid,Glen Santayana,Paperback,44.39,"A prison + school hybrid. The thesis looks to address the outflow of prisoners and combat the challenges of recidivism. This is done through the implementation of a new typology of prison facility that symbiotically merges the program of incarceration and education. Rather than regarding prisons simply as a means of punishment that might ensure ex-convicts have no other future, this new system of higher education incarceration will promote rehabilitation and the creation of new productive members of society.",2013,English,N/A,Education & Language,All Rights Reserved - Standard Copyright License,By (author): Glen Santayana,126,Paperback,Color,US Trade (6 x 9 in / 152 x 229 mm),,"['Glen Santayana', 'Harvard University', 'GSD', 'Prischool', 'prison', 'education', 'thesis']"
https://www.lulu.com//shop/latoya-franklyn/college-as-reality/paperback/product-1ngr5q7n.html?q=Harvard+University,College as Reality,LaToya Franklyn,Paperback,18.99,"Navigating the college and scholarship application process can be daunting, but it doesn’t have to be that way.

LaToya Franklyn, who attended Vanderbilt University, UC Berkeley School of Law, and Harvard Law School on full academic and community service scholarships, walks you through how to get accepted into the schools that you prefer—and just as important—how to get the money to go there.

Filled with application tools, practical advice, and educational tips, this is an incredible resource for college-bound readers, parents, and guidance counselors. College-bound students will learn how to:

·	stand out as an attractive and competitive candidate;
·	carry out the mechanics of applying for college and scholarships;
·	overcome negative circumstances; and
·	set and accomplish meaningful goals.",2016,English,9781483448237,Education & Language,All Rights Reserved - Standard Copyright License,By (author): LaToya Franklyn,126,Paperback,Black & White,A5 (5.83 x 8.27 in / 148 x 210 mm),,"['college', 'scholarships', 'debt free', 'education', 'university', 'funding', 'grants', 'loans', 'loan free', 'work study', 'money', 'save money', 'guide', 'school', 'college applications', 'scholarship applications', 'teens', 'young adults', 'parents', 'families', 'financial freedom', 'success']"
https://www.lulu.com//shop/jm-martin/the-masseur/paperback/product-1g8nq6j6.html?q=Harvard+University,The Masseur,J.M. MARTIN,Paperback,12.87,"In this paperback Novel...Susan meets a Masseur at Harvard University. She decides to share the day with him. It is one of the best day's she's ever had in her life. But... Susan's decision to spend the day with the Masseur, causes the two of them to have to fight for their lives. Susan has to try and get them out of the mess that she got them in...before it's too late....",2015,English,9781312950412,Fiction,All Rights Reserved - Standard Copyright License,By (author): J.M. MARTIN,144,Paperback,Black & White,US Trade (6 x 9 in / 152 x 229 mm),,"['romance', 'true love', 'sex', 'relationships', 'mystery']"
https://www.lulu.com//shop/charles-henry-brent/with-god-in-the-world-a-series-of-papers/paperback/product-1mqe9p6k.html?q=Harvard+University,With God in the World: A Series of Papers,Charles Henry Brent,Paperback,7.23,"Hint: You can preview this book by clicking on ""Preview"" which is located under the cover of this book.

About the author:

Charles Brenton Huggins (September 22, 1901 – January 12, 1997) was a Canadian-American physician, physiologist and cancer researcher at the University of Chicago specializing in prostate cancer. He was awarded the 1966 Nobel Prize for Physiology or Medicine for discovering in 1941 that hormones could be used to control the spread of some cancers. This was the first discovery that showed that cancer could be controlled by chemicals.Huggins was born in Halifax, Nova Scotia, Canada. He graduated from Acadia University with a BA degree in 1920. He went on to study medicine at Harvard University and received his MD degree in 1924.
Excerpt from: https://en.wikipedia.org/wiki/Charles_Brenton_Huggins",2016,English,N/A,Religion & Spirituality,All Rights Reserved - Standard Copyright License,By (author): Charles Henry Brent,84,Paperback,Black & White,US Trade (6 x 9 in / 152 x 229 mm),,"['brent', 'charles', 'christianity', 'god', 'henry', 'papers', 'series', 'world:']"
https://www.lulu.com//shop/jm-martin/the-masseur/hardcover/product-18rzknre.html?q=Harvard+University,The Masseur,J.M. MARTIN,Hardcover,26.99,"In this hardcover with dust jacket...Susan meets a Masseur at Harvard University. She decides to share the day with him. It is one of the best day's she's ever had in her life. But... Susan's decision to spend the day with the Masseur, causes the two of them to have to fight for their lives. Susan has to try and get them out of the mess that she got them in...before it's too late....",2015,English,9781312932234,Fiction,All Rights Reserved - Standard Copyright License,By (author): J.M. MARTIN,144,Hardcover,Black & White,US Trade (6 x 9 in / 152 x 229 mm),,"['romance', 'sex', 'relationships', 'true love']"
https://www.lulu.com//shop/elizabeth-stuart-phelps/avery/paperback/product-17qzmwk4.html?q=Harvard+University,Avery,Elizabeth Stuart Phelps,Paperback,6.86,"Avery Odelle Craven (August 12, 1885 near Ackworth, Iowa – January 21, 1980, Chesterton, Indiana) was a historian who specialized in the study of the nineteenth-century United States and the American Civil War.Craven's parents were Quakers who left North Carolina because of slavery and racism. Craven graduated from Simpson College in 1908. He earned an M.A. from Harvard in 1914, where he was influenced by Frederick Jackson Turner. He earned a Ph.D. from the University of Chicago in 1923, Studying with Marcus Jernegan as well as William E Dodd. He taught at Michigan State University and the University of Illinois; in 1927, he joined the faculty of the University of Chicago, where he spent the rest of his career.
Excerpt from: https://en.wikipedia.org/wiki/Avery_Craven

Hint: You can preview this book by clicking on ""Preview"" which is located under the cover of this book.",2016,English,N/A,Fiction,All Rights Reserved - Standard Copyright License,By (author): Elizabeth Stuart Phelps,58,Paperback,Black & White,US Trade (6 x 9 in / 152 x 229 mm),,"['avery', 'conduct', 'elizabeth', 'fiction', 'invalids', 'life', 'married', 'people', 'phelps', 'stuart']"
https://www.lulu.com//shop/frank-hamilton-cushing/with-god-in-the-world-a-series-of-papers/paperback/product-1kmg7jq7.html?q=Harvard+University,With God in the World: A Series of Papers,Frank Hamilton Cushing,Paperback,8.82,"Hint: You can preview this book by clicking on ""Preview"" which is located under the cover of this book.

About the author:

Charles Brenton Huggins (September 22, 1901 – January 12, 1997) was a Canadian-American physician, physiologist and cancer researcher at the University of Chicago specializing in prostate cancer. He was awarded the 1966 Nobel Prize for Physiology or Medicine for discovering in 1941 that hormones could be used to control the spread of some cancers. This was the first discovery that showed that cancer could be controlled by chemicals.Huggins was born in Halifax, Nova Scotia, Canada. He graduated from Acadia University with a BA degree in 1920. He went on to study medicine at Harvard University and received his MD degree in 1924.
Excerpt from: https://en.wikipedia.org/wiki/Charles_Brenton_Huggins",2016,English,N/A,Religion & Spirituality,All Rights Reserved - Standard Copyright License,By (author): Frank Hamilton Cushing,198,Paperback,Black & White,US Trade (6 x 9 in / 152 x 229 mm),,"['brent', 'charles', 'christianity', 'god', 'henry', 'papers', 'series', 'world:']"
https://www.lulu.com//shop/anton-yakovlev/chronos-dines-alone/paperback/product-1vjdjyv4.html?q=Harvard+University,Chronos Dines Alone,Anton Yakovlev,Paperback,8.49,"Born in Moscow, Russia, Anton Yakovlev is a graduate of Harvard University currently living in the New York metropolitan area. He is the author of “Ordinary Impalers” (Kelsay Books, 2017) and two prior chapbooks. His poems have appeared in The New Yorker, The Hopkins Review, Measure, The Stockholm Review of Literature, and elsewhere. ""In these unsparing, unsettling, sometimes surreal poems, he makes us feel what it’s like to be alive in our time—grappling with fear, grief, bewilderment, chaos, and brute contingency. These poems are a rare hybrid of intelligence and imagination. Yakovlev is a unique talent in American poetry,"" writes
Jennifer Franklin, the author of “No Small Gift” (Four Way Books.)",2018,English,9781912963010,Poetry,All Rights Reserved - Standard Copyright License,By (author): Anton Yakovlev,42,Paperback,Black & White,A5 (5.83 x 8.27 in / 148 x 210 mm),,"['Poetry', 'American Poetry', 'Experimental Poetry', 'Surrealism', 'Surrealist Poetry', 'SurVision Magazine', 'SurVision Books']"
https://www.lulu.com//shop/robert-wood-darby/first-person-crazy/paperback/product-124vjk6y.html?q=Harvard+University,First Person Crazy,Robert Wood Darby,Paperback,9.54,"Autobiographical work by and about Bob Darby, a lifelong human rights activist. Darby came of age as a privileged Caucasian in the segregated South during the civil rights conflict at home and during the Vietnam War. 
     When Darby graduated from Emory University and  enrolled  at Harvard and Tufts, he found many who shared his dedication to the anti-war movement. Few of Darby’s friends realized that he was also fighting a very personal war. The sensitive and gifted young man’s manic depression sometimes led to wild exuberance and other times to suicidal attempts to end his own life.
     He became a man with empathy for downtrodden people through serving as a civil rights advocate, peace activist, and the founder of “Food Not Bombs” in Atlanta, Georgia. His writings make the reader feel the excitement and frustration of his adventures and passion for social justice and his quest for normalcy. Parts of these chapters also appear in his book “Betrayal and Conviction” published in February of 2019.",2019,English,9780359784066,Biographies & Memoirs,All Rights Reserved - Standard Copyright License,By (author): Robert Wood Darby,120,Paperback,Black & White,US Trade (6 x 9 in / 152 x 229 mm),,"['Harvard', 'Mental Illness', 'Protestors', 'Vietnam War', 'civil rights', 'rascism']"
https://www.lulu.com//shop/john-forrest-jr/remembering-paul-beeson/hardcover/product-1jwe8jje.html?q=Harvard+University,Remembering Paul Beeson,"John Forrest, Jr.",Hardcover,35.00,"This book contains descriptions of 22 persons, professors of medicine, many of them trained by Beeson, who write about their recollections of Paul Beeson.  The book follows Beeson’s life, from his birth, early childhood in Alaska, college at the University of Washington, medical school at McGill, and residency at the University of Pennsylvania, to and private practice with his father and brother in Wooster Ohio. Seeing that he was not very good at surgery, Dr. Beeson took a fellowship at Rockefeller Institute in New York City with Osswald Avery.  He then served as Chief Resident to the renowned Soma Weiss at the Peter Bent Brigham Hospital at Harvard, which led to the Chairmanships of the Departments of medicine at Emory, Yale, and Oxford, to a distinguished Professor at the VA in Seattle Washington. The book concludes with the speakers comments at Beeson’s memorial service at Yale.",2019,English,N/A,Biographies & Memoirs,All Rights Reserved - Standard Copyright License,"By (author): John Forrest, Jr.",198,Linen Wrap,Black & White,US Trade (6 x 9 in / 152 x 229 mm),,"['Physicians', 'Medical History']"
https://www.lulu.com//shop/brooks-adams/the-theory-of-social-revolutions/paperback/product-1dj7dqqj.html?q=Harvard+University,The Theory of Social Revolutions,Brooks Adams,Paperback,7.76,"Hint: You can preview this book by clicking on ""Preview"" which is located under the cover of this book.

About the author:

Peter Chardon Brooks Adams (June 24, 1848 - February 13, 1927) was an American historian and a critic of capitalism.He graduated from Harvard University in 1870 and studied at Harvard Law School in 1870 and 1871. Adams believed that commercial civilizations rise and fall in predictable cycles. First, masses of people draw together in large population centers and engage in commercial activities. As their desire for wealth grows, they discard spiritual and creative values. Their greed leads to distrust and dishonesty, and eventually the society crumbles. In The Law of Civilization and Decay (1895), Adams noted that as new population centers emerged in the west, centers of world trade shifted from Constantinople to Venice to Amsterdam to London.
Excerpt from: https://en.wikipedia.org/wiki/Brooks_Adams",2016,English,N/A,History,All Rights Reserved - Standard Copyright License,By (author): Brooks Adams,122,Paperback,Black & White,US Trade (6 x 9 in / 152 x 229 mm),,"['adams', 'brooks', 'courts', 'government', 'politics', 'revolutions', 'social', 'states', 'theory', 'united']"
https://www.lulu.com//shop/albert-bushnell-hart/the-mentor-benjamin-franklin-vol-6-num-7-serial-no-155-may-15-1918/paperback/product-12jn9d7w.html?q=Harvard+University,"The Mentor: Benjamin Franklin, Vol. 6, Num. 7, Serial No. 155, May 15, 1918",Albert Bushnell Hart,Paperback,6.95,"Hint: You can preview this book by clicking on ""Preview"" which is located under the cover of this book.

About the author:

Albert Bushnell Hart (July 1, 1854–July 16, 1943), was an American historian based at Harvard, writer, and editor. One of the first generation of professionally trained historians in the United States, a prolific author and editor of historical works, Albert Bushnell Hart became, as Samuel Eliot Morison described him, ""The Grand Old Man"" of American history, looking the part with his ""patriarchal full beard and flowing moustaches. ""Hart was born in Clarksville (now Clark), Mercer County, Pennsylvania. He graduated from Harvard University in 1880. He was a member of Phi Beta Kappa and a classmate and friend of future U.S. President Theodore Roosevelt. He studied at Paris, Berlin and Freiburg, and received his doctorate from Freiburg in 1883.
Excerpt from: https://en.wikipedia.org/wiki/Albert_Bushnell_Hart",2016,English,N/A,History,All Rights Reserved - Standard Copyright License,By (author): Albert Bushnell Hart,64,Paperback,Black & White,US Trade (6 x 9 in / 152 x 229 mm),,"['6', '7', '15', '155', '1918', 'albert', 'benjamin', 'bushnell', 'franklin', 'hart', 'may', 'mentor:', 'no', 'num', 'serial', 'vol']"
https://www.lulu.com//shop/michael-froelich/african-justice-institute/ebook/product-1gv79wp5.html?q=Harvard+University,African Justice Institute,Michael Froelich,Ebook,2.50,You have heard of the blood diamond wars of Sierra Leone.  Now Michael Froelich's book African Justice Institute tells the truth behind the scenes and what really happened and caused the wars of Sierra Leone.  Michael Froelich is a former scholar of international relations and military affairs at M.I.T. and Harvard University who has retired from a career as an intelligence agent for several different countries.  Michael lived in Freetown during the Blood Diamonds Wars and his book tells the history from his first hand experiences.,2011,English,N/A,History,All Rights Reserved - Standard Copyright License,By (author): Michael Froelich,,,,,PDF,"['african', 'justice', 'sierra leone', 'blood diamonds', 'diamonds']"
https://www.lulu.com//shop/alan-m-garber/competition-integration-and-incentives-the-quest-for-efficiency-in-the-english-nhs/paperback/product-1mwdq69r.html?q=Harvard+University,"Competition, integration and incentives: The quest for efficiency in the English NHS",Alan M Garber,Paperback,18.52,"The clash between the desire to improve services and the need to confront straitened financial circumstances is a central policy problem – perhaps the central problem – for the UK’s Coalition Government. This report, by Professor Alan Garber of Harvard University (and the current Nuffield Trust Rock Carling Fellow), looks at how best the UK can balance competition, integration and incentives in the quest for efficiency in its National Health Service.

Nuffield Trust publications can be downloaded free of charge from www.nuffieldtrust.org.uk",2011,English,9781905030514,Science & Medicine,All Rights Reserved - Standard Copyright License,By (author): Alan M Garber,70,Paperback,Black & White,Crown Quarto (7.44 x 9.68 in / 189 x 246 mm),,"['health care', 'US health care', 'international comparisons', 'GP commissioning', 'NHS']"
https://www.lulu.com//shop/brooks-adams/the-emancipation-of-massachusetts/paperback/product-19kv84ve.html?q=Harvard+University,The Emancipation of Massachusetts,Brooks Adams,Paperback,10.98,"Hint: You can preview this book by clicking on ""Preview"" which is located under the cover of this book.

About the author:

Peter Chardon Brooks Adams (June 24, 1848 - February 13, 1927) was an American historian and a critic of capitalism.He graduated from Harvard University in 1870 and studied at Harvard Law School in 1870 and 1871. Adams believed that commercial civilizations rise and fall in predictable cycles. First, masses of people draw together in large population centers and engage in commercial activities. As their desire for wealth grows, they discard spiritual and creative values. Their greed leads to distrust and dishonesty, and eventually the society crumbles. In The Law of Civilization and Decay (1895), Adams noted that as new population centers emerged in the west, centers of world trade shifted from Constantinople to Venice to Amsterdam to London.
Excerpt from: https://en.wikipedia.org/wiki/Brooks_Adams",2016,English,N/A,History,All Rights Reserved - Standard Copyright License,By (author): Brooks Adams,352,Paperback,Black & White,US Trade (6 x 9 in / 152 x 229 mm),,"['1600', '1775', 'adams', 'brooks', 'ca', 'church', 'colonial', 'emancipation', 'f001', 'history', 'massachusetts', 'period', 'puritans']"
