URL,Title,Author,Type,Price,Summary,Publication Year,Language,ISBN,Category,Copyright,Contributors,Pages,Binding,Interior Color,Dimensions,Format,Keywords
https://www.lulu.com//shop/francis-parkman/pioneers-of-france-in-the-new-world/paperback/product-1z4nqmdg.html?q=Harvard+University,Pioneers of France in the New World,Francis Parkman,Paperback,10.78,"Hint: You can preview this book by clicking on ""Preview"" which is located under the cover of this book.

About the author:

Francis Parkman, Jr. (September 16, 1823 – November 8, 1893) was an American historian, best known as author of The Oregon Trail: Sketches of Prairie and Rocky-Mountain Life and his monumental seven-volume France and England in North America. These works are still valued as historical sources and as literature. He was also a leading horticulturist, briefly a professor of Horticulture at Harvard University and author of several books on the topic. Parkman was a trustee of the Boston Athenæum from 1858 until his death in 1893.Parkman was born in Boston, Massachusetts to the Reverend Francis Parkman Sr. (1788–1853), a member of a distinguished Boston family, and Caroline (Hall) Parkman. The senior Parkman was minister of the Unitarian New North Church in Boston from 1813 to 1849.
Excerpt from: https://en.wikipedia.org/wiki/Francis_Parkman",2016,English,N/A,History,All Rights Reserved - Standard Copyright License,By (author): Francis Parkman,338,Paperback,Black & White,US Trade (6 x 9 in / 152 x 229 mm),,"['1562', '1565', '1567', '1635', '1763', 'canada', 'champlain', 'colony', 'f1001', 'florida', 'france', 'francis', 'history', 'huguenot', 'new', 'parkman', 'pioneers', 'samuel', 'states', 'united', 'world']"
https://www.lulu.com//shop/francis-parkman/la-salle-and-the-discovery-of-the-great-west-france-and-england-in-north-america/paperback/product-17qzwr2v.html?q=Harvard+University,La Salle and the Discovery of the Great West France and England in North America,Francis Parkman,Paperback,12.69,"Hint: You can preview this book by clicking on ""Preview"" which is located under the cover of this book.

About the author:

Francis Parkman, Jr. (September 16, 1823 – November 8, 1893) was an American historian, best known as author of The Oregon Trail: Sketches of Prairie and Rocky-Mountain Life and his monumental seven-volume France and England in North America. These works are still valued as historical sources and as literature. He was also a leading horticulturist, briefly a professor of Horticulture at Harvard University and author of several books on the topic. Parkman was a trustee of the Boston Athenæum from 1858 until his death in 1893.Parkman was born in Boston, Massachusetts to the Reverend Francis Parkman Sr. (1788–1853), a member of a distinguished Boston family, and Caroline (Hall) Parkman. The senior Parkman was minister of the Unitarian New North Church in Boston from 1813 to 1849.
Excerpt from: https://en.wikipedia.org/wiki/Francis_Parkman",2016,English,N/A,Biographies & Memoirs,All Rights Reserved - Standard Copyright License,By (author): Francis Parkman,474,Paperback,Black & White,US Trade (6 x 9 in / 152 x 229 mm),,"['1643', '1687', 'america', 'biography', 'cavelier', 'discovery', 'england', 'exploration', 'explorers', 'f1001', 'france', 'francis', 'great', 'mississippi', 'new', 'north', 'parkman', 'river', 'robert', 'salle', 'sieur', 'valley', 'west']"
https://www.lulu.com//shop/michael-fox/nouwen-on-transformation-hardcover/hardcover/product-1v9nzrnq.html?q=Harvard+University,Nouwen on Transformation (Hardcover),Michael Fox,Hardcover,25.00,"Henri Nouwen [1924 to 1996]—a Dutch author, professor, and pastor of international acclaim—wrote extensively of the spiritual life. Nouwen was ordained as a priest in 1957; he studied psychology at the Catholic University of Nijmegen and, later, at the Menninger Clinic in the States. He taught at Notre Dame and the Divinity Schools of Yale and Harvard. Henri Nouwen’s forty books include The Return of the Prodigal Son, The Wounded Healer, The Way of the Heart, Reaching Out, Turn My Mourning into Dancing, and Compassion. Upon the tenth anniversary of Henri’s passing, Michael Christensen and Rebecca Laird began the process of distilling Henri’s prolific words into a framework that would encourage spiritual formation; their work is presented in three volumes titled Spiritual Direction, Spiritual Formation, Discernment. These learning maps have been designed to teach spiritual companions—directors, coaches, pastors, friends—the wisdom of Henri Nouwen around spiritual formation. Hardback version.",2014,English,N/A,Religion & Spirituality,All Rights Reserved - Standard Copyright License,By (author): Michael Fox,42,Hardcover,Color,US Letter (8.5 x 11 in / 216 x 279 mm),,"['Christian', 'coaching', 'self improvement', 'discipleship', 'comtemplative', 'spiritual formation', 'spiritual direction', 'spiritual transformation']"
https://www.lulu.com//shop/norm-harshaw/stay-strong/ebook/product-wgj5rz.html?q=Harvard+University,Stay Strong,Norm Harshaw,Ebook,4.99,"How do you get down to the ""Real"" conversation in your business? In your life?Are you surrounding yourself with the clients and/or friends that are making you successful? Does your purpose sentence guide your every future step, in life and business? Are you hiding your real self to impress others and being miserable in the process?
My grand challenge is what this book is about, and the title of this book; Stay Strong and sit in an I AM ENOUGH confidence. Self-confidence is one of the subject's personality researchers and mental health professionals most like to study. Thousands of journal articles have been devoted to it, along with dozens of books telling adults how to raise their own self-confidence or their children's (Harvard health-Harvard University). Why is confidence, or lack thereof, one of the most studied and written about subjects in the world? Because at one time or another; we all struggle, no one is immune. It doesn't matter your age, occupation, skin color, nationality, job type, or whether you are a professional athletes, actors, actresses, or politician, we all struggle the same. In fact, it seems the more in the public spotlight you are, the harder you must protect your confidence.
I am here to give you hope from a real-world view, learned in the trenches of life and business. This is street smarts, not book smarts. This is real, not manufactured stats in some lab or classroom where the researchers are living in a bubble-nothing wrong with academic papers but when is the last time you read one, or cared to?",2021,English,9781291561593,Business & Economics,All Rights Reserved - Standard Copyright License,By (author): Norm Harshaw,,,,,EPUB,"['Self help', 'Motivational', 'Business Culture', 'Inspirational', 'Personal development', 'Success', 'Transformational', 'Business success', 'Happiness']"
https://www.lulu.com//shop/jon-snow/psy-530-week-4-assignment-latest/paperback/product-19e7wp58.html?q=Harvard+University,PSY 530 WEEK 4 ASSIGNMENT LATEST,Jon Snow,Paperback,8.06,"PSY 530 WEEK 4 ASSIGNMENT LATEST-GCU

Just Click on Below Link To Download This Course:

URL= https://www.tutorialsexperts.us/product/psy-530-week-4-assignment-latest-gcu/

Or Email us
[email protected]
PSY 530 Week 4 Assignment Latest-GCU
Take one (gender, age, race, sexuality, disability, or weight) of the Implicit Association Tests (IAT) at the Harvard University website. In 750-1,000 words, address the following:
1. Examine how attitude is formed.
2. Discuss how personal implicit biases can form understandings at a local, national or global level.
3. Analyze the strengths and weaknesses of the IAT as a research tool.
4. Reflect on your personal results from the IAT.
Use three to five scholarly sources to support your thinking, your textbook can be used as one of the resources. Prepare this assignment according to the guidelines found in the APA Style Guide, located in the Student Success Center. An abstract is not required.",2018,English,N/A,Education & Language,All Rights Reserved - Standard Copyright License,By (author): Jon Snow,2,Saddle Stitch,Black & White,US Letter (8.5 x 11 in / 216 x 279 mm),,"['INTERNATIONAL STUDY', 'COMPUTER SCiENCE', 'ENGINEERING & TECHNOLOGY', 'Accounting', 'Business']"
https://www.lulu.com//shop/francis-parkman/a-half-century-of-conflict-volume-i-france-and-england-in-north-america/paperback/product-1ng5m8y5.html?q=Harvard+University,A Half Century of Conflict - Volume I France and England in North America,Francis Parkman,Paperback,9.75,"Hint: You can preview this book by clicking on ""Preview"" which is located under the cover of this book.

About the author:

Francis Parkman, Jr. (September 16, 1823 – November 8, 1893) was an American historian, best known as author of The Oregon Trail: Sketches of Prairie and Rocky-Mountain Life and his monumental seven-volume France and England in North America. These works are still valued as historical sources and as literature. He was also a leading horticulturist, briefly a professor of Horticulture at Harvard University and author of several books on the topic. Parkman was a trustee of the Boston Athenæum from 1858 until his death in 1893.Parkman was born in Boston, Massachusetts to the Reverend Francis Parkman Sr. (1788–1853), a member of a distinguished Boston family, and Caroline (Hall) Parkman. The senior Parkman was minister of the Unitarian New North Church in Boston from 1813 to 1849.
Excerpt from: https://en.wikipedia.org/wiki/Francis_Parkman",2016,English,N/A,History,All Rights Reserved - Standard Copyright License,By (author): Francis Parkman,264,Paperback,Black & White,US Trade (6 x 9 in / 152 x 229 mm),,"['1600', '1763', '1775', 'america', 'ca', 'canada', 'century', 'colonial', 'conflict', 'e186', 'england', 'france', 'francis', 'half', 'history', 'new', 'north', 'parkman', 'period', 'states', 'united', 'volume']"
https://www.lulu.com//shop/william-james/the-varieties-of-religious-experience/ebook/product-1dmnmd9z.html?q=Harvard+University,The Varieties of Religious Experience,William James,Ebook,2.99,"The Varieties of Religious Experience: A Study in Human Nature is a book by the Harvard University psychologist and philosopher William James. These lectures concerned the nature of religion and the neglect of science, in James' view, in the academic study of religion. Soon after its publication, the book entered the canon of psychology and philosophy, and has remained in print for over a century. James went on to develop his philosophy of pragmatism; there are many overlapping ideas in Varieties and his 1907 book, Pragmatism. The lectures discussed the distinction between symbolism and reality. Symbols, such as the word ""steak"" on a menu, do not embody the actuality of the objects they represent. The word ""steak"" on a menu merely points to some slab of meat in the back of the restaurant. In a similar way, James posits that all of science is fundamentally detached from reality since the tools of science are merely pointers to some actual objective realm.",2012,English,9781105581427,Religion & Spirituality,All Rights Reserved - Standard Copyright License,By (author): William James,,,,,EPUB,"['the varieties of', 'religious experience', 'psychology of religion', 'comparative religion', 'psychology', 'philosophy of religion', 'philosophy', 'religion', 'mysticism', 'mystical experiences', 'pragmatism', 'states of consciousness', 'transcendental experience', 'peak experiences']"
https://www.lulu.com//shop/james-fenimore-cooper/the-pathfinder-or-the-inland-sea/paperback/product-1q5q4p26.html?q=Harvard+University,"The Pathfinder; Or, The Inland Sea",James Fenimore Cooper,Paperback,12.99,"Hint: You can preview this book by clicking on ""Preview"" which is located under the cover of this book.

About the author:

James Fenimore Cooper (September 15, 1789 – September 15, 1851) was a prolific and popular American writer of the early 19th century.His historical romances of frontier and Indian life in the early American days created a unique form of American literature. He lived most of his life in Cooperstown, New York, which was founded by his father William on property that he owned. Cooper was a lifelong member of the Episcopal Church and, in his later years, contributed generously to it. He attended Yale University for three years, where he was a member of the Linonian Society, but was expelled for misbehavior.Before embarking on his career as a writer, he served in the U.S. Navy as a Midshipman, which greatly influenced many of his novels and other writings.
Excerpt from: https://en.wikipedia.org/wiki/James_Fenimore_Cooper",2016,English,N/A,History,All Rights Reserved - Standard Copyright License,By (author): James Fenimore Cooper,496,Paperback,Black & White,US Trade (6 x 9 in / 152 x 229 mm),,"['1754', '1763', 'bumppo', 'character', 'classics', 'cooper', 'fenimore', 'fiction', 'fictitious', 'french', 'harvard', 'historical', 'history', 'indian', 'inland', 'james', 'natty', 'pathfinder;', 'states', 'stories', 'united']"
https://www.lulu.com//shop/malia-hatashe/has-an-in-twitter-just-showing-people-how-great-malia-is/hardcover/product-1dmem94p.html?q=Harvard+University,HAS AN IN TWITTER: Just showing people how great Malia is!,Malia Hatashe,Hardcover,24.30,"“Has an in twitter: Just showing people how great Malia is!” is Malia's second book, mainly collection of her twitter messages. Price: $ 24 (print), $1.50 (pdf), ISBN: 978-1-304-89694-0 and Content ID: 14428017. This book Published by Bob Young and Tom Bright of Lulu.com (Lulu Enterprises, Inc. and Lulu Press, Inc.), 3101 Hillsborough St, Raleigh, NC 27607-5436, USA. Malia was born in 4th July 1998 in Chicago, Illinois. Currently she is studding at Sidwell Friends School, Maryland, Washington D.C. She and her sister Natasha Shaha began attending Sidwell Friends School in January of 2009 after her family moved to Washington, D.C. Malia has keen interest on Science, especially Mathematics and Physics. She is also coauthor of “The Machine that Would Predict the Future: Prime Radiant device Obama and Maliatashe’s Hypothesis” with Hatashe. She proposed United States Declaration of Independence as Theory of Prediction and Obama Equations Factors which is known as Malia’s Hypothesis.",2014,English,9781304896940,Biographies & Memoirs,All Rights Reserved - Standard Copyright License,By (author): Malia Hatashe,34,Linen Wrap,Black & White,US Trade (6 x 9 in / 152 x 229 mm),,"['Malia', 'Twitter', 'Sidwell Friends School', 'Barack Obama', 'Institute of Psychohistory', 'Harvard University', 'White House', 'Bob Young', 'Tom Bright', 'Lulu Press', 'Maliatashe']"
https://www.lulu.com//shop/matthew-schultz-and-michelle-moloney-king-and-beir-bua-press/encomium-cento-paradelles/paperback/product-4gqnqq.html?q=Harvard+University,Encomium: Cento Paradelles,Matthew Schultz,Paperback,10.99,"Matthew Schultz is the Director of the Writing Center and Adjunct Associate Professor of English. He earned both his B.A. and M.A. in English Literature at John Carroll University and his Ph.D. in English Literature from Saint Louis University where he specialized in Irish Studies, Literary Modernism, and Postcolonial Theory.
Matt is the author of Haunted Historiographies: The Rhetoric of Ideology in Postcolonial Irish Fiction (Manchester University Press, 2014) and Joycean Arcana: Ulysses and the Tarot de Marseille (EyeCorner Press 2020). He also edited Postcolonial Star Wars: Essays on Empire and Rebellion in a Galaxy Far, Far Away (Cambridge Scholars Press, 2020). His essays on Irish literary history have appeared in journals like Irish Studies Review, James Joyce Quarterly, Postcolonial Text, and Literature & Aesthetics.
Additionally, Matt has published two novels—On Coventry (Harvard Square Editions, 2015) and We, The Wanted (John Hunt Publishing 2021). His poetry appears in over 60 journals and magazines including 2River where his chapbook, Parallax, is available. Matt also has a chapbook and full-length collection forthcoming from ELJ Editions in May 2022.
Matt began studying poetry in earnest when he discovered the works of W.B. Yeats as an undergraduate. This led him quickly to the works of Paul Muldoon, Seamus Heaney, and Eamon Grennan, all of whom he pay homage to in this collection of poems that grew out of a want to enter into conversation with these poets. The first paradelle appeared in Picnic, Lightning (1998) by the American poet Billy Collins as a parody of the villanelle. While Collins mocks the form in a playful sort of way, Matt uses the paradelle to uncover interesting new images that he then twists into surreal narratives. Encomium simultaneously shows reverence for and reimagines works by the paragons of Irish poetry.",2022,English,9781914972263,Poetry,All Rights Reserved - Standard Copyright License,"By (author): Matthew Schultz, Edited by: Beir Bua Press, Cover design or artwork by: Michelle Moloney King",32,Paperback,Black & White,A5 (5.83 x 8.27 in / 148 x 210 mm),,"['beir bua press', 'poetry', 'Matthew Schultz', 'Cento Paradelles', 'PARADELLE']"
https://www.lulu.com//shop/samuel-willard-and-c-matthew-mcmahon/gods-covenant-and-our-duty/ebook/product-18rn64d9.html?q=Harvard+University,God's Covenant and Our Duty,C. Matthew McMahon,Ebook,5.99,"Samuel Willard (1640-1707) was a reformed preacher of the Gospel in the old South Boston Church in New England, president of Harvard University, and one of the great Calvinistic teachers of his day.

Willard teaches Christians about God's condescension to us by way of His covenant, and in light of that, how we are to live before Him. He covers the basics of the Covenant of Redemption, Covenant or Works and Covenant of Grace, to fully explain the biblical mandate and obligation to perform our duty in God's covenant. Christians cannot just profess that Christ is Lord; their outward actions must demonstrate the reality of the Spirit's work in their lives. He covers what it means to ""keep covenant"" with God, what a covenant breaker is, and how we are to use the covenant promises found in Scripture for our sanctification. 

This work is not a scan or facsimile, has been carefully transcribed by hand being made easy to read in modern English, and has an active table of contents for electronic versions.",2015,English,9781626631359,Religion & Spirituality,All Rights Reserved - Standard Copyright License,"By (author): C. Matthew McMahon, By (author): Samuel Willard",,,,,EPUB,"['samuel willard', 'election', 'christian duty', 'limited atonement', 'unconditional election', 'irresistible grace', 'apuritansmind', 'puritan sermons', 'puritan theology', 'reformed theology', 'covenant theology', 'Westminster confession', 'calvini']"
https://www.lulu.com//shop/william-henry-giles-kingston/the-young-rajah/paperback/product-17qz2m8j.html?q=Harvard+University,The Young Rajah,William Henry Giles Kingston,Paperback,8.57,"The Young Rajah is a 1922 silent film starring Rudolph Valentino. The film was based on the book Amos Judd by John Ames Mitchell.After fifteen years, Joshua Judd (Charles Ogle) tells his adopted son, Amos (Valentino), that his real father was an Indian maharajah overthrown by Ali Khan (Bertram Grassby). Amos, then a young boy (played by an uncredited Pat Moore), was rescued by General Devi Das Gadi (George Periolat) and taken to America for his safety. (Joshua's merchant brother had been a trusted friend of the late maharajah. )Amos attends Harvard University. There he incurs the hatred of Austin Slade, Jr. (Jack Giddings), whom he beats out for a spot on the rowing team. At a party celebrating a rowing victory over arch-rival Yale, a jealous Slade calls Amos ""yellow"" and pours a drink on him, causing Amos to punch him.
Excerpt from: https://en.wikipedia.org/wiki/The_Young_Rajah

Hint: You can preview this book by clicking on ""Preview"" which is located under the cover of this book.",2016,English,N/A,Fiction,All Rights Reserved - Standard Copyright License,By (author): William Henry Giles Kingston,180,Paperback,Black & White,US Trade (6 x 9 in / 152 x 229 mm),,"['fiction', 'giles', 'henry', 'india', 'kingston', 'rajah', 'william', 'young']"
https://www.lulu.com//shop/harriet-simons/east-oak-grove/ebook/product-1rekjq7q.html?q=Harvard+University,East Oak Grove,Harriet Simons,Ebook,3.99,"Gloria Ruth Mason begins her story May 2, 1980, when she and her four childhood friends sit in the West Virginia University Coliseum waiting to receive their diplomas. The five girls realize this day marks the first of many life-changing events. Isabella “Alma” Argenteri will be leaving in the fall to attend Harvard Law School. Rosemary “Romie” Greco will be eloping that day with a recent graduate of WVU Medical School. And Carmela “Bunny” Schumo, Melissa “Tilly” Lepera, and Gloria Ruth “Sue” Mason have no idea what adventures lie ahead. Dreams of a bright future turn dark eight days after graduation when Alma and her car end up in the bottom of Cheat Lake. Because everyone scattered after graduation, only Sue and Tilly attend Alma’s funeral. Sue decides to create a phone tree journal for everyone where contact numbers would be listed, along with blank pages where each girl could journal. None of them knew how important those journals would come to be in the years to come.",2014,English,9781483410807,Fiction,All Rights Reserved - Standard Copyright License,By (author): Harriet Simons,,,,,EPUB,"['East Oak Grove', 'Cemetery', 'Childhood Friends', 'Best Friends', 'Friends', 'Women', 'Journals', 'Love', 'Morgantown', 'West Virginia', 'University', 'Tragedy', 'Redemption', 'Secrets', 'Hospice', 'Public Library', ""Mario's Fishbowl"", ""Gene's"", 'Beer Garden']"
https://www.lulu.com//shop/dr-angela-isom/thongs-bra-straps/paperback/product-1ngp2d9.html?q=Harvard+University,Thongs & Bra Straps,Dr. Angela Isom,Paperback,15.11,"As a teen, Dr. Isom moved with an abusive drug addicted boyfriend. They were usually hungry and on the verge of being homeless. This was compounded by the fact that her father was imprisoned and drug addicted. Despite these barriers, she eventually returned to high school. She went from all F's to all A's. She earned lots of college scholarships to pay for school and her rent. Later, Isom left her middle school sweetheart. Along her journey, she became a single mom. Her son's father wouldn't speak to her until God changed his heart. She turned to welfare to make ends meet. She didn't let any of this stop her. By age 22, she was in grad school at Case Western Reserve University. She also founded an organization that led to television appearances and a newspaper front page. By age 24, she was teaching college. By 25, she was attending Harvard. At 28, she became senior professor. Since then, she has: written an autobiography, led people worldwide to God, met the U.S. President, and earned a doctorate degree.",2007,English,9780979729904,Biographies & Memoirs,All Rights Reserved - Standard Copyright License,By (author): Dr. Angela Isom,93,Paperback,Black & White,US Trade (6 x 9 in / 152 x 229 mm),,['Dr. Angela Isom']
https://www.lulu.com//shop/john-georges-neville/for-the-record-the-life-and-times-of-john-william-neville-1908-1973/hardcover/product-16rk6d6m.html?q=Harvard+University,"For the Record: The Life and Times of John William Neville, 1908-1973",John Georges Neville,Hardcover,99.01,"A third generation Canadian, John William Neville left Ottawa, where he and his parents had been born and always lived, to begin his studies at Harvard Law School in 1929. He had excelled academically and athletically at the University of Ottawa from where he graduated with three degrees at the age of 20. Before him lay not only academic challenges, but also financial ones as he tried to earn his place in a world which would be devastated by the Great Depression and World War II. He could not have anticipated that he would meet a French war-widow to whom he would be married for a relatively short time and with whom he would have a son. The bitter divorce prompted a campaign of slander against him that would threaten his career and his relationship with his only child. He deserved better treatment. This book, written by his son, attempts to clear his name ""For the Record"" and to honor this exceptional man and the life he lived.",2016,English,N/A,Biographies & Memoirs,All Rights Reserved - Standard Copyright License,By (author): John Georges Neville,456,Linen Wrap,Color,US Letter (8.5 x 11 in / 216 x 279 mm),,['Neville Ottawa Leclerc']
